<!ELEMENT menu (desayunos)*>
        <!ELEMENT desayunos (nombre|precio|desc|calorias)*>
        <!ELEMENT nombre (#PCDATA)>
        <!ELEMENT precio (#PCDATA)>
        <!ELEMENT desc (#PCDATA)>
        <!ELEMENT calorias (#PCDATA)>